{"acquisition": [{"channel": "app goes online (Uber/Bolt/Deliveroo/Flex)", "owner": "marketplace", "risk": "total dependence — deactivation = $0 income overnight; multi-app or die"}, {"channel": "quests + incentives", "owner": "marketplace", "risk": "chasing bad quests below floor rate"}, {"channel": "private regulars (rare, precious)", "owner": "direct", "risk": "none — off-app cash at full rate where permitted"}], "compliance_spine": [{"failure_mode": "PCO/licence lapse = instant deactivation", "requirement": "PCO + insurance + MOT dates watched", "source": "TfL / platforms"}, {"failure_mode": "SA penalty + interest", "requirement": "Weekly tax set-aside + SA103S from ledger", "source": "HMRC"}], "dark_data": ["true £/hour net of ALL miles (most drivers quote gross)", "platform £/mile ranking from own history", "quest ROI (bonus vs extra miles burned)"], "dead_data": ["weekly summaries never compared across platforms", "expense receipts in glovebox, unlogged"], "margin_leaks": [{"mechanism": "below-floor trips accepted (dead miles ignored)", "name": "sub-floor trips", "stat": "Proven-window driving beats random hours 20%+; floor must include dead miles", "stat_basis": "verified-2026"}, {"mechanism": "no weekly sweep; January surprise", "name": "tax surprise", "stat": "55p/mile to 10k from Apr 2026 — biggest deduction most drivers underclaim", "stat_basis": "verified-2026"}, {"mechanism": "single-app dependence + deactivation exposure", "name": "platform concentration", "stat_basis": "template-analysis"}], "pain_ranking": [{"fix_id": "FIX-UNPRICED-EXTRAS", "pain": "driving below true cost (dead miles ignored)", "rank": 1, "why": "Most drivers don't know their net £/hour — the floor fixes everything downstream"}, {"fix_id": "FIX-SILENT-CHURN", "pain": "tax surprise from no set-aside", "rank": 2, "why": "Weekly sweep turns January from crisis to admin"}, {"fix_id": "FIX-MARKETPLACE-TAX", "pain": "single-platform dependence", "rank": 3, "why": "Multi-app comparison is free money and deactivation insurance"}], "scaling_wall": {"bottleneck": "hours in the day + vehicle wear: linear income, accelerating depreciation", "breaks_at": "60+ hrs/week (the answer is better £/hour, not more hours)"}, "teardown_id": "td-gig-driver-gb", "template_id": "tpl-gig-driver-gb", "vertical": "gig_driver"}