{"acquisition": [{"channel": "PPM contracts (commercial/FM/landlords)", "owner": "repeat", "risk": "none once won — retender risk at renewal, needs SLA evidence"}, {"channel": "breakdown callouts", "owner": "direct", "risk": "missed = facilities manager rings the next contractor"}, {"channel": "install tenders (heat pumps, retrofit wave)", "owner": "referral", "risk": "none — energy-infra demand from 2027 (PwC) is structural"}], "compliance_spine": [{"failure_mode": "unlogged refrigerant = failed audit + fines", "requirement": "F-Gas per-gram logging per asset", "source": "F-Gas Regulation"}, {"failure_mode": "uncertified engineer on notifiable work", "requirement": "F-Gas / Gas Safe / NICEIC per-engineer register", "source": "schemes"}, {"failure_mode": "missed SLA triggers penalties / contract loss", "requirement": "Contract SLA clocks", "source": "commercial contracts"}], "dark_data": ["first-time-fix rate per engineer", "van stock gaps causing return visits", "PPM defect-to-quote conversion rate"], "dead_data": ["service sheets filed never", "asset age profiles never used for replacement pitches"], "margin_leaks": [{"mechanism": "engineer arrives without part; second visit eats the margin", "name": "return visits", "stat_basis": "template-analysis"}, {"mechanism": "defects found on PPM never quoted", "name": "unconverted defects", "stat_basis": "template-analysis"}, {"mechanism": "Ai:den-class dispatch absent; wrong skill sent", "name": "dumb dispatch", "stat": "Ai:den claims -40-60% scheduling time; Commusoft 7-10x cheaper than ServiceTitan at 50 heads", "stat_basis": "verified-2026"}], "pain_ranking": [{"fix_id": "FIX-COMPLIANCE-DRIFT", "pain": "F-Gas/cert/SLA drift across engineers and sites", "rank": 1, "why": "Failed audit or lapsed cert stops work entirely — existential, not marginal"}, {"fix_id": "FIX-UNPRICED-EXTRAS", "pain": "PPM defects never converted to quoted work", "rank": 2, "why": "Every maintenance visit is a revenue event currently walking out the door"}, {"fix_id": "FIX-MISSED-INBOUND", "pain": "breakdown calls missed / misdispatched", "rank": 3, "why": "Facilities managers have short memories and long vendor lists"}], "scaling_wall": {"bottleneck": "the diary + engineer skill matching — wrong engineer sent, certs unchecked, parts missing", "breaks_at": "5+ engineers or multi-site contracts"}, "teardown_id": "td-hvac-gb", "template_id": "tpl-hvac-gb", "vertical": "hvac"}