{"acquisition": [{"channel": "footfall + passing trade", "owner": "direct", "risk": "rent pays for location; declining footfall strands it"}, {"channel": "Google / local search", "owner": "direct", "risk": "invisible to shopping agents = invisible (Deloitte 2026)"}, {"channel": "repeat locals", "owner": "repeat", "risk": "none — loyalty is the independent's only durable edge vs chains"}], "compliance_spine": [{"failure_mode": "VAT misaccounting across rates", "requirement": "MTD VAT with correct product splits", "source": "HMRC"}, {"failure_mode": "age-restricted sale breach", "requirement": "Challenge 25 + refusal logs where applicable", "source": "licensing law"}], "dark_data": ["£/sqft by category (what earns the shelf?)", "basket attach rate (what sells with what?)", "shrink by SKU (what walks out?)"], "dead_data": ["EPOS reports never reviewed", "supplier price rises never passed through"], "margin_leaks": [{"mechanism": "K-shaped squeeze: costs up, value forced down, middle hollowed", "name": "cost-price squeeze", "stat": "PwC 2026: growth won't cover cost growth; NIC + NLW + Employment Rights Bill", "stat_basis": "verified-2026"}, {"mechanism": "stockouts on winners, markdowns on dogs", "name": "range/stock imbalance", "stat_basis": "template-analysis"}, {"mechanism": "products invisible to AI shopping surfaces", "name": "AI invisibility", "stat": "9 in 10 execs expect AI over search (Deloitte 2026)", "stat_basis": "verified-2026"}], "pain_ranking": [{"fix_id": "FIX-UNPRICED-EXTRAS", "pain": "cost-price squeeze with no measured response", "rank": 1, "why": "PwC: winners invest + take share now — measurement first"}, {"fix_id": "FIX-MARKETPLACE-TAX", "pain": "invisibility to shopping agents", "rank": 2, "why": "AI readability is the new shop window; free to fix, fatal to ignore"}, {"fix_id": "FIX-SILENT-CHURN", "pain": "regulars drifting to chains/value players unwatched", "rank": 3, "why": "Loyalty data exists in the till — use it"}], "scaling_wall": {"bottleneck": "the owner: buying, staffing, books, floor — all one human", "breaks_at": "2nd site (needs managers + real reporting)"}, "teardown_id": "td-retail-gb", "template_id": "tpl-retail-gb", "vertical": "retail"}