{"acquisition": [{"channel": "the round itself (density compounds)", "owner": "repeat", "risk": "none — round IS the schedule; lose the round habit, lose the business"}, {"channel": "street canvassing", "owner": "direct", "risk": "none — fill streets not postcodes"}, {"channel": "referrals from round customers", "owner": "referral", "risk": "none — neighbours watch the work"}], "compliance_spine": [{"failure_mode": "ladders + working at height incident", "requirement": "Risk assessment + insurance for WAH work", "source": "HSE / insurers"}], "dark_data": ["£/hour per street (density economics)", "skip patterns (who always skips December?)", "first-clean conversion rate"], "dead_data": ["paper round book nobody else can read", "old prices never reviewed against costs"], "margin_leaks": [{"mechanism": "cleans done unbilled; credits given verbally", "name": "unlogged skips", "stat_basis": "template-analysis"}, {"mechanism": "missed DDs never chased; next visit done anyway", "name": "unchased debt", "stat_basis": "template-analysis"}, {"mechanism": "2-3x work at standard price", "name": "underpriced first cleans", "stat_basis": "template-analysis"}], "pain_ranking": [{"fix_id": "FIX-UNPRICED-EXTRAS", "pain": "unlogged skips + unchased debt + flat first-cleans", "rank": 1, "why": "Round economics decided entirely by skip/credit/debt discipline"}, {"fix_id": "FIX-SILENT-CHURN", "pain": "lapsed round customers never re-canvassed", "rank": 2, "why": "The street already knows the van — cheapest acquisition there is"}, {"fix_id": "FIX-MARKETPLACE-TAX", "pain": "paper round book as single point of failure", "rank": 3, "why": "Lose the book, lose the business — digitise the round"}], "scaling_wall": {"bottleneck": "the round book in one head: routes, prices, skips, debts", "breaks_at": "2nd round (needs run sheets + live completion)"}, "teardown_id": "td-window-cleaner-gb", "template_id": "tpl-window-cleaner-gb", "vertical": "window_cleaner"}