{"acquisition": [{"channel": "council commissioning blocks", "owner": "repeat", "risk": "retender cycles; evidence of outcomes wins them"}, {"channel": "private-pay families (self-funders)", "owner": "direct", "risk": "choice-driven, review-sensitive, higher margin"}, {"channel": "hospital discharge teams", "owner": "referral", "risk": "none — reablement pipeline if outcomes evidenced"}], "compliance_spine": [{"failure_mode": "failed CQC inspection / rating drop kills referrals", "requirement": "KLOE evidence pack always ready (safe/caring/responsive/effective/well-led)", "source": "CQC"}, {"failure_mode": "missed meds = safeguarding incident", "requirement": "MAR-gap same-day escalation", "source": "safeguarding / duty of care"}, {"failure_mode": "uncertified carer on rota", "requirement": "DBS/Right-to-Work/training hard gates on rostering", "source": "regulations"}], "dark_data": ["visit profitability per package (travel + duration vs rate)", "carer turnover predictors (lone + far + nights?)"], "dead_data": ["visit notes never audited for quality", "family feedback never collected"], "margin_leaks": [{"mechanism": "travel + gaps between calls unbilled on contact time", "name": "unpaid travel gaps", "stat_basis": "template-analysis"}, {"mechanism": "churn + agency cover at premium", "name": "carer turnover", "stat_basis": "template-analysis"}, {"mechanism": "council rates squeezed while costs rise", "name": "rate squeeze", "stat": "685k worker demand to 2035; care workers +199k single biggest occupation (Skills England)", "stat_basis": "govt-data"}], "pain_ranking": [{"fix_id": "FIX-COMPLIANCE-DRIFT", "pain": "CQC/MAR/DBS drift across carers and visits", "rank": 1, "why": "Rating drop kills referrals; missed meds are safeguarding — existential"}, {"fix_id": "FIX-MISSED-INBOUND", "pain": "rota gaps unfilled (sick calls at 6am)", "rank": 2, "why": "Uncovered visits breach duty and contract simultaneously"}, {"fix_id": "FIX-SILENT-CHURN", "pain": "packages never reviewed against needs", "rank": 3, "why": "Reviews grow hours legitimately — unworked reviews shrink them"}], "scaling_wall": {"bottleneck": "registered manager + coordinators: rota, cover, audits, family calls", "breaks_at": "~50 service users (needs area coordinators)"}, "teardown_id": "td-care-gb", "template_id": "tpl-care-gb", "vertical": "care"}