{"acquisition": [{"channel": "accountant referrers (clean-client pipeline)", "owner": "referral", "risk": "none — be the referrer's favourite source of clean books"}, {"channel": "MTD-fear content (deadline-driven inbound)", "owner": "direct", "risk": "spiky around mandates; evergreen between"}, {"channel": "SparkAgent attach motion", "owner": "repeat", "risk": "none — 70% take-rate target on existing base (drop campaign)"}], "compliance_spine": [{"failure_mode": "HMRC penalties for clients", "requirement": "MTD VAT + ITSA quarterly filings on time, every client", "source": "HMRC (VAT in force; ITSA £50k+ Apr 2026)"}, {"failure_mode": "unapproved advice/chase sent as firm", "requirement": "Human approval on all outbound money comms", "source": "firm policy"}], "dark_data": ["exception patterns per client (same supplier unmapped monthly?)", "chase effectiveness (which wording gets paid?)", "scope creep (bookkeeping client asking for advisory free?)"], "dead_data": ["bank feeds connected never reviewed", "year-end packs rebuilt from scratch annually"], "margin_leaks": [{"mechanism": "hours burned matching pennies the client could confirm in seconds", "name": "manual exception grind", "stat": "Kill metric: ≥80% unaided clear rate or fix models first (drop campaign)", "stat_basis": "verified-2026"}, {"mechanism": "hundreds of quarterly checkpoints per practice with no tracking", "name": "MTD quarter chaos", "stat": "ITSA £50k+ Apr 2026, £30k+ 2027, £20k+ 2028 — checkpoint volume explodes", "stat_basis": "verified-2026"}, {"mechanism": "advisory given away inside £29/mo package", "name": "scope bleed", "stat_basis": "template-analysis"}], "pain_ranking": [{"fix_id": "FIX-UNPRICED-EXTRAS", "pain": "manual exception grind at fixed-fee prices", "rank": 1, "why": "Fixed-fee + manual work = margin death; ≥80% unaided or the model fails"}, {"fix_id": "FIX-COMPLIANCE-DRIFT", "pain": "MTD quarter chaos across hundreds of checkpoints", "rank": 2, "why": "Missed quarters = penalties = churn; tracking is the product"}, {"fix_id": "FIX-SILENT-CHURN", "pain": "scope bleed into free advisory", "rank": 3, "why": "Package boundaries need enforcing or ARPU decays"}], "scaling_wall": {"bottleneck": "review capacity: every period needs human eyes before filing", "breaks_at": "200+ clients (needs exception-only review, not line review)"}, "teardown_id": "td-bookkeeping-gb", "template_id": "tpl-bookkeeping-gb", "vertical": "bookkeeping"}