{"acquisition": [{"channel": "Booksy marketplace", "owner": "marketplace", "risk": "2.3x listings vs Fresha but 30% Boost commission + app owns the relationship"}, {"channel": "Fresha marketplace", "owner": "marketplace", "risk": "20% new-client cut; cheap base hides variable cost"}, {"channel": "walk-in + referral", "owner": "direct", "risk": "none — highest margin, must be captured to owned widget"}, {"channel": "Instagram discovery", "owner": "direct", "risk": "platform risk, convert to bookable link"}], "compliance_spine": [{"failure_mode": "untrained handling of data + payments", "requirement": "UK GDPR + PCI-compliant card handling", "source": "UK GDPR / card schemes"}], "dark_data": ["which regulars are slipping (visit gaps)", "which services actually profit after product cost", "chair utilisation by day-part"], "dead_data": ["marketplace analytics never reviewed", "review counts never actioned"], "margin_leaks": [{"annual_impact_note": "8% of bookings industry-wide; a 6-chair shop loses ~10 cuts/week", "mechanism": "empty chair, no revenue, product already opened", "name": "no-shows", "stat": "8% of bookings lost; deposits cut no-shows 57%", "stat_basis": "verified-2026"}, {"mechanism": "30% Boost commission on claimed-new clients; 20% Fresha new-client cut", "name": "marketplace tax", "stat": "Booksy 2.3x UK listings vs Fresha; Boost 30%, Fresha 20%", "stat_basis": "verified-2026"}, {"mechanism": "quiet chairs with no fill motion", "name": "dead chair time", "stat_basis": "template-analysis"}], "pain_ranking": [{"fix_id": "FIX-NOSHOW", "pain": "no-shows empty chairs with zero recourse", "rank": 1, "why": "Direct revenue loss daily; deposits are proven -57%"}, {"fix_id": "FIX-MARKETPLACE-TAX", "pain": "marketplace owns the client and taxes acquisition", "rank": 2, "why": "Discovery needed, but repeats must move direct or margin bleeds forever"}, {"fix_id": "FIX-SILENT-CHURN", "pain": "lapsed regulars never win-backed", "rank": 3, "why": "Cheapest revenue in the building, currently unworked"}], "scaling_wall": {"bottleneck": "the diary + the phone — double bookings, missed calls, no reminders", "breaks_at": "3+ chairs or second location"}, "teardown_id": "td-barber-gb", "template_id": "tpl-barber-gb", "vertical": "barber"}