{"acquisition": [{"channel": "Booking.com (15-18%) / Expedia / Airbnb", "owner": "marketplace", "risk": "commission + parity history; guest relationship rented"}, {"channel": "direct website", "owner": "direct", "risk": "under-invested booking engine; parity now legally beatable but few do it"}, {"channel": "corporate / repeat", "owner": "repeat", "risk": "none — highest net, needs perks to stay direct"}], "compliance_spine": [{"failure_mode": "overbooking + walk crisis", "requirement": "Two-way channel-manager sync (rates + availability + reservations back)", "source": "OTA contracts"}, {"failure_mode": "VAT mis-split accommodation vs extras", "requirement": "MTD VAT records", "source": "HMRC"}, {"failure_mode": "guest data across borders mishandled", "requirement": "UK GDPR + EU GDPR (SCCs) for EU guests", "source": "UK/EU GDPR"}], "dark_data": ["true net per channel per booking (commission + VAT + promos)", "shoulder-night demand patterns", "upsell attach rate (breakfast/late checkout)"], "dead_data": ["guest history never used for return offers", "review text never mined for ops fixes"], "margin_leaks": [{"annual_impact_note": "£21.6k/yr on £120k OTA volume (Brighton example); 20% shift direct saves £4k+", "mechanism": "15-18% commission on every OTA night vs ~2% direct", "name": "OTA commission", "stat": "Booking.com 15-18%; parity clauses dead (BGH/DMA) — direct can legally undercut", "stat_basis": "verified-2026"}, {"mechanism": "unsold night = £0 forever; static rates in variable demand", "name": "unpriced perishability", "stat_basis": "template-analysis"}, {"mechanism": "dirty room blocks check-in; late checkout unsold", "name": "turnover friction", "stat_basis": "template-analysis"}], "pain_ranking": [{"fix_id": "FIX-MARKETPLACE-TAX", "pain": "OTA commission with no direct-recovery motion", "rank": 1, "why": "Parity death is a one-time structural gift — undercut legally, convert systematically"}, {"fix_id": "FIX-SILENT-CHURN", "pain": "OTA guests never converted to direct", "rank": 2, "why": "Every OTA checkout is a direct-booking lead if worked"}, {"fix_id": "FIX-NOSHOW", "pain": "late cancels + no-shows on sellable nights", "rank": 3, "why": "Same deposit mechanics as restaurant, per-night stakes"}], "scaling_wall": {"bottleneck": "front desk + housekeeping coordination — arrivals, turnovers, and complaints collide at 3pm", "breaks_at": "20+ rooms or second property"}, "teardown_id": "td-hotel-gb", "template_id": "tpl-hotel-gb", "vertical": "hotel"}