{"acquisition": [{"channel": "word of mouth + Instagram results", "owner": "referral", "risk": "unmeasured; before/after photos scattered across phones"}, {"channel": "Google search (high intent, high ticket)", "owner": "direct", "risk": "consultation no-shows expensive at clinical hourly rates"}, {"channel": "marketplace/referral sites", "owner": "marketplace", "risk": "same tax dynamic, smaller scale than barber"}], "compliance_spine": [{"failure_mode": "treatment without valid consent; adverse event without paper trail", "requirement": "Versioned consent per treatment + patch-test records", "source": "clinical duty of care"}, {"failure_mode": "expired qualifications on invasive treatments", "requirement": "Practitioner insurance + qualification verification", "source": "insurers"}, {"failure_mode": "expired/uncalibrated device injures client", "requirement": "Device service + shot-count logs", "source": "manufacturers / insurers"}], "dark_data": ["course completion rates (who drops out at session 3?)", "top-up intervals actually observed vs prescribed", "consult-to-course conversion rate"], "dead_data": ["paper consent forms in filing cabinets", "device manuals nobody re-reads"], "margin_leaks": [{"mechanism": "consult done, course never sold; no follow-up sequence", "name": "consult leakage", "stat_basis": "template-analysis"}, {"mechanism": "sessions drift past due dates; client never recalled", "name": "course dropout + missed top-ups", "stat_basis": "template-analysis"}, {"mechanism": "device idle while bookable; service lapse blocks bookings", "name": "device downtime", "stat_basis": "template-analysis"}], "pain_ranking": [{"fix_id": "FIX-UNPRICED-EXTRAS", "pain": "consults that never convert to courses", "rank": 1, "why": "Highest-ticket leak: the consult cost is sunk, the course is pure margin"}, {"fix_id": "FIX-SILENT-CHURN", "pain": "top-up intervals missed, courses abandoned", "rank": 2, "why": "Recall timing IS the revenue in aesthetics"}, {"fix_id": "FIX-COMPLIANCE-DRIFT", "pain": "consent/device/insurance drift", "rank": 3, "why": "One adverse event without paperwork ends the business"}], "scaling_wall": {"bottleneck": "practitioner diary + device contention — double-booked laser, verbal recalls", "breaks_at": "2nd device or 2nd practitioner"}, "teardown_id": "td-medspa-gb", "template_id": "tpl-medspa-gb", "vertical": "medspa"}