{"acquisition": [{"channel": "Rover/Wag discovery (~20%/40%)", "owner": "marketplace", "risk": "steepest marketplace tax in any template — migrate repeats fast"}, {"channel": "local groups + park reputation", "owner": "referral", "risk": "none — visible daily work is the advert"}, {"channel": "vet/groomer referrals", "owner": "referral", "risk": "none — reciprocal, high trust"}], "compliance_spine": [{"failure_mode": "lost dog / bite incident without protocol", "requirement": "Incident protocol per pet + insurance + DBS", "source": "insurers / duty of care"}, {"failure_mode": "wrong meds / missed medical flag on walk", "requirement": "Medical + behavior flags surfaced pre-walk, <10s access", "source": "duty of care"}], "dark_data": ["route profitability per area (drive time vs walk revenue)", "walker capacity vs demand by day", "seasonal demand (holiday boarding spikes)"], "dead_data": ["walk photos never posted (marketing gold wasted)", "GPS tracks never reviewed for route improvement"], "margin_leaks": [{"mechanism": "40% per booking to Wag with no migration motion", "name": "marketplace bleed", "stat": "Rover ~20%, Wag ~40% — steepest in any template", "stat_basis": "verified-2026"}, {"mechanism": "drive time unbilled between scattered clients", "name": "route sprawl", "stat_basis": "template-analysis"}, {"mechanism": "single walks where groups would pay same per dog", "name": "ungrouped walks", "stat_basis": "template-analysis"}], "pain_ranking": [{"fix_id": "FIX-MARKETPLACE-TAX", "pain": "40% marketplace bleed with no direct migration", "rank": 1, "why": "Steepest tax anywhere — TendPets-flat-sub pattern exists, use it"}, {"fix_id": "FIX-SILENT-CHURN", "pain": "lapsed owners never re-engaged", "rank": 2, "why": "Dogs keep needing walks; lapses are scheduling failures, not demand loss"}, {"fix_id": "FIX-COMPLIANCE-DRIFT", "pain": "behavior/medical flags living in heads", "rank": 3, "why": "One incident without protocol undoes years of trust"}], "scaling_wall": {"bottleneck": "trusted walkers: clients buy the walker, not the brand", "breaks_at": "3+ walkers (needs area splits + report-card standards)"}, "teardown_id": "td-petcare-gb", "template_id": "tpl-petcare-gb", "vertical": "petcare"}