{"acquisition": [{"channel": "repeat plans (weekly/fortnightly/monthly)", "owner": "repeat", "risk": "none — the plan base is the business"}, {"channel": "referrals + local groups", "owner": "referral", "risk": "none — cheapest acquisition there is"}, {"channel": "one-off deep cleans → plan conversion", "owner": "direct", "risk": "conversion unmeasured, most leak away"}], "compliance_spine": [{"failure_mode": "unvetted stranger with house keys; incident without cover", "requirement": "ID + reference checks; liability insurance current", "source": "insurers / duty of care"}], "dark_data": ["visit profitability per client (travel + time vs price)", "cancellation patterns (who always cancels?)", "upsell take-rate (oven/fridge add-ons)"], "dead_data": ["feedback never requested", "before/after photos never posted"], "margin_leaks": [{"mechanism": "travel + parking + materials unbilled on fixed prices", "name": "unpriced extras (travel/materials)", "stat_basis": "template-analysis"}, {"mechanism": "quiet weeks with staffed hours", "name": "rota gaps", "stat_basis": "template-analysis"}, {"mechanism": "per-user SaaS scaling with heads (£300-600/mo at 20 staff vs £60 flat UK)", "name": "tooling creep", "stat": "Jobber ~£310/mo vs ProCleanerUK ~£60-100/mo at 20 staff", "stat_basis": "verified-2026"}], "pain_ranking": [{"fix_id": "FIX-SILENT-CHURN", "pain": "paused/cancelled plans never win-backed", "rank": 1, "why": "5-10 recoverable clients/mo = £500-2,000 MRR walking away"}, {"fix_id": "FIX-UNPRICED-EXTRAS", "pain": "travel/materials/deep-clean extras unbilled", "rank": 2, "why": "Death by a thousand unbilled extras on fixed prices"}, {"fix_id": "FIX-MARKETPLACE-TAX", "pain": "per-user tooling tax scaling with heads", "rank": 3, "why": "Flat-rate UK tooling exists — the tax is optional"}], "scaling_wall": {"bottleneck": "rota + quality control: who goes where, and was it actually clean?", "breaks_at": "5+ cleaners (needs area leads + photo proof)"}, "teardown_id": "td-cleaning-gb", "template_id": "tpl-cleaning-gb", "vertical": "cleaning"}