{"acquisition": [{"channel": "RMM alerts auto-ticketed", "owner": "direct", "risk": "none — machine-generated demand, infinite patience required"}, {"channel": "client calls/emails/portal", "owner": "direct", "risk": "missed = SLA breach from minute one"}, {"channel": "projects + onboarding new clients", "owner": "repeat", "risk": "none — expansion revenue, highest margin"}], "compliance_spine": [{"failure_mode": "breach unreported; client data exposed", "requirement": "Incident response + notification discipline", "source": "UK GDPR / contracts"}, {"failure_mode": "credential in ticket, exfiltrated later", "requirement": "Secrets as refs, never values, everywhere", "source": "security policy"}, {"failure_mode": "SLA penalties + churn", "requirement": "Contract SLA attainment reported honestly", "source": "MSAs"}], "dark_data": ["ticket-type profitability (which work loses money?)", "technician utilisation vs burnout", "password-reset volume (self-service opportunity)"], "dead_data": ["RMM alert tuning never done (alert fatigue)", "time entries never reviewed for leakage"], "margin_leaks": [{"mechanism": "all-you-can-eat tickets on fixed-fee contracts", "name": "unscoped demand", "stat_basis": "template-analysis"}, {"mechanism": "$400-700/tech/mo tooling + 2-3x implementation year one", "name": "tool sprawl", "stat": "Mid-market PSA+RMM+docs commonly $400-700/tech/mo all-in", "stat_basis": "verified-2026"}, {"mechanism": "hours worked, never invoiced", "name": "time leakage", "stat_basis": "template-analysis"}], "pain_ranking": [{"fix_id": "FIX-MISSED-INBOUND", "pain": "triage queue neglect (alerts + tickets aging unowned)", "rank": 1, "why": "SLA breach is instant churn risk; consistent triage is the whole product"}, {"fix_id": "FIX-COMPLIANCE-DRIFT", "pain": "secrets in tickets + unreported incidents", "rank": 2, "why": "One breach ends the MSP; refs-everywhere is non-negotiable"}, {"fix_id": "FIX-UNPRICED-EXTRAS", "pain": "out-of-scope work absorbed silently", "rank": 3, "why": "Scope discipline decides contract profitability"}], "scaling_wall": {"bottleneck": "dispatch + senior escalation: juniors stuck, seniors interrupted", "breaks_at": "10+ techs (needs pods + real triage function)"}, "teardown_id": "td-msp-gb", "template_id": "tpl-msp-gb", "vertical": "it_helpdesk"}