{"acquisition": [{"channel": "Deliveroo / Uber Eats / Just Eat", "owner": "marketplace", "risk": "30% headline = 36% effective; discovery rented at margin"}, {"channel": "walk-in + regulars", "owner": "direct", "risk": "must be captured to direct channels or re-acquired via aggregator every order"}, {"channel": "reservations (ResDiary/SevenRooms/OpenTable)", "owner": "direct", "risk": "no-show risk without deposit policy"}], "compliance_spine": [{"failure_mode": "allergic reaction without ingredient trail", "requirement": "Ingredient-level allergen data (Natasha's Law PPDS)", "source": "UK food law"}, {"failure_mode": "tips unlawfully distributed; missing records", "requirement": "100% pass-through + written policy + 3yr records", "source": "Fair Tips Act (Oct 2024)"}, {"failure_mode": "VAT mis-split eat-in vs takeaway (20% hot delivery)", "requirement": "MTD VAT with correct channel splits", "source": "HMRC"}], "dark_data": ["true net per channel per dish (after commission + VAT-on-commission + promos)", "no-show patterns by sitting (which sittings need deposits)", "dish-level margin after waste"], "dead_data": ["EPOS reports exported never", "review counts never answered"], "margin_leaks": [{"annual_impact_note": "£32,760/yr per 100 orders/wk vs own site", "mechanism": "30% commission + VAT-on-commission + promos + ads stack silently", "name": "aggregator take", "stat": "30% headline = 36% effective; Just Eat 14% order-only", "stat_basis": "verified-2026"}, {"annual_impact_note": "8% of bookings sector-wide", "mechanism": "held table, staffed service, no revenue", "name": "reservation no-shows", "stat": "76% of venues hit; deposits cut no-shows 57%", "stat_basis": "verified-2026"}, {"mechanism": "unmeasured spoilage + over-portioning", "name": "waste", "stat_basis": "template-analysis"}], "pain_ranking": [{"fix_id": "FIX-MARKETPLACE-TAX", "pain": "aggregator take with no per-channel P&L", "rank": 1, "why": "Biggest structural cost after rent + payroll; £32k/yr recoverable per 100 orders/wk"}, {"fix_id": "FIX-NOSHOW", "pain": "reservation no-shows on staffed sittings", "rank": 2, "why": "Proven -57% fix, selective by sitting value"}, {"fix_id": "FIX-SILENT-CHURN", "pain": "regulars re-acquired via aggregator every order", "rank": 3, "why": "Bag-flyer QR direct conversion compounds forever"}], "scaling_wall": {"bottleneck": "the pass + the phone: kitchen throughput and reservation handling collapse together on Friday", "breaks_at": "second site or 100+ covers/night"}, "teardown_id": "td-restaurant-gb", "template_id": "tpl-restaurant-gb", "vertical": "restaurant"}