{"acquisition": [{"channel": "repeat + MOT-due base", "owner": "repeat", "risk": "none — the book is the business; lose the reminder habit, lose the book"}, {"channel": "word of mouth + Google", "owner": "referral", "risk": "review-dependent"}, {"channel": "breakdown / recovery agents", "owner": "referral", "risk": "none — be the garage they tow to"}], "compliance_spine": [{"failure_mode": "unroadworthy release; invalid MOT", "requirement": "MOT tester authorisation + DVSA standards", "source": "DVSA"}, {"failure_mode": "customer dispute without evidence", "requirement": "DVI photos + signed estimates pre-work", "source": "consumer law / Motor Ombudsman"}], "dark_data": ["bay utilisation by day (which bay earns?)", "parts margin per job", "estimate approval lag (quotes dying in inboxes)"], "dead_data": ["old MOT advisories never followed up", "service history never mined for upsell"], "margin_leaks": [{"mechanism": "work started on verbal, customer disputes the bill", "name": "unapproved estimates", "stat_basis": "template-analysis"}, {"mechanism": "parts bought at trade, fitted at guess-margin", "name": "parts margin slide", "stat_basis": "template-analysis"}, {"mechanism": "MOT-due drivers never reminded, book elsewhere", "name": "silent MOT churn", "stat_basis": "template-analysis"}], "pain_ranking": [{"fix_id": "FIX-UNPRICED-EXTRAS", "pain": "estimates approved verbally or not at all", "rank": 1, "why": "Every dispute starts here; gated approval ends it"}, {"fix_id": "FIX-SILENT-CHURN", "pain": "MOT-due base never systematically recalled", "rank": 2, "why": "The book compounds if worked, decays if not"}, {"fix_id": "FIX-MISSED-INBOUND", "pain": "phones unanswered at ramp time", "rank": 3, "why": "Breakdown + MOT-season calls go to whoever answers"}], "scaling_wall": {"bottleneck": "ramps + techs: bays full, phones ringing, estimates unsent", "breaks_at": "3+ bays or 2nd site"}, "teardown_id": "td-garage-gb", "template_id": "tpl-garage-gb", "vertical": "garage"}