{"acquisition": [{"channel": "local reputation + Google", "owner": "referral", "risk": "review-dependent; emergency needs decide in minutes"}, {"channel": "pet insurance directs (Petplan etc.)", "owner": "referral", "risk": "none — claim-path integration locks the flow"}, {"channel": "new-pet registrations (breeders, rescues)", "owner": "direct", "risk": "none — lifetime value starts at first jab"}], "compliance_spine": [{"failure_mode": "failed unannounced RCVS inspection", "requirement": "CD register (MDR 2001) + PSS evidence pack always ready", "source": "RCVS / Misuse of Drugs Regulations 2001"}, {"failure_mode": "dispensing error / untraceable batch", "requirement": "VMR 2013 batch + prescriber + 5yr retention per dispense", "source": "Veterinary Medicines Regulations 2013"}], "dark_data": ["species/breed profitability (which patients pay?)", "vaccine-lapse lists", "lab turnaround delays by provider"], "dead_data": ["old radiographs never reviewed", "weight trends never flagged"], "margin_leaks": [{"mechanism": "15min admin per claim vs 2min direct; 3-5 days slower payment", "name": "manual insurance claims", "stat": "Only Animana does Petplan direct (2026); 20+ claims/mo = cash-flow lever", "stat_basis": "verified-2026"}, {"mechanism": "nurse time transcribing analyser values", "name": "manual lab transcription", "stat": "Patient-safety issue, not efficiency — auto-post or risk error", "stat_basis": "verified-2026"}, {"mechanism": "IDEXX tightening bundles year by year", "name": "diagnostic lock-in drift", "stat": "IDEXX owns ~80% of cloud PIMS segment", "stat_basis": "verified-2026"}], "pain_ranking": [{"fix_id": "FIX-COMPLIANCE-DRIFT", "pain": "CD register + PSS evidence scramble", "rank": 1, "why": "Unannounced inspection with a paper-parallel register is the nightmare scenario"}, {"fix_id": "FIX-UNPRICED-EXTRAS", "pain": "manual claims + transcription tax", "rank": 2, "why": "Nurse hours + cash-flow days, both recoverable"}, {"fix_id": "FIX-SILENT-CHURN", "pain": "vaccine/booster lapses unworked", "rank": 3, "why": "Silent, schedulable, high-margin demand"}], "scaling_wall": {"bottleneck": "vet consult hours: everything clinical funnels through 10-minute slots", "breaks_at": "3rd vet (needs nurse-led clinics + triage to protect vet time)"}, "teardown_id": "td-vet-gb", "template_id": "tpl-vet-gb", "vertical": "vet"}