{"acquisition": [{"channel": "word of mouth + Checkatrade/Google", "owner": "referral", "risk": "review-dependent; one bad job echoes"}, {"channel": "inbound calls/SMS/WhatsApp (often mid-job, often missed)", "owner": "direct", "risk": "missed = lost to whoever picks up"}, {"channel": "letting agents / landlords (repeat commercial)", "owner": "repeat", "risk": "none — highest lifetime value, needs servicing like a contract"}], "compliance_spine": [{"failure_mode": "uncertified work on notifiable jobs; invalidates insurance", "requirement": "EICR/Gas Safe/Part P competence per job type", "source": "building regs / schemes"}, {"failure_mode": "CIS penalties; cash-flow shock", "requirement": "CIS verification + deductions via accounting", "source": "HMRC"}], "dark_data": ["quote win/loss rate + reasons", "travel time per job (unbilled hours)", "callback/rework rate per job type"], "dead_data": ["van mileage logs never totalled", "old quotes never followed up"], "margin_leaks": [{"mechanism": "no answer → caller rings the next sparky", "name": "missed calls", "stat": "Trades miss the majority of calls at height; voice-agent recovery is the top-ROI fix in the template", "stat_basis": "template-analysis"}, {"mechanism": "materials bought retail, quoted flat, waste unbilled", "name": "materials margin slide", "stat_basis": "template-analysis"}, {"mechanism": "quotes sent, never chased", "name": "quote leakage", "stat_basis": "template-analysis"}], "pain_ranking": [{"fix_id": "FIX-MISSED-INBOUND", "pain": "missed calls while on the tools", "rank": 1, "why": "Every missed call is a job for a competitor; recovery compounds"}, {"fix_id": "FIX-UNPRICED-EXTRAS", "pain": "extras done on a nod, never billed", "rank": 2, "why": "Same disease as builder variations, smaller tickets, higher frequency"}, {"fix_id": "FIX-COMPLIANCE-DRIFT", "pain": "cert coverage gaps discovered at the worst moment", "rank": 3, "why": "One notifiable job with the wrong ticket risks everything"}], "scaling_wall": {"bottleneck": "the owner: quoting nights, dispatch mornings, invoices weekends", "breaks_at": "2nd van (dispatch + quoting split from tools)"}, "teardown_id": "td-electrician-gb", "template_id": "tpl-electrician-gb", "vertical": "electrician"}