{"acquisition": [{"channel": "marketplaces (Superprof free-list, Preply/italki, MyTutor)", "owner": "marketplace", "risk": "hidden cuts (Tutorful closed + unpublished; MyTutor undisclosed) — rented discovery"}, {"channel": "parent referral + school gates", "owner": "referral", "risk": "none — trust-based, highest conversion"}, {"channel": "direct (own booking + packages)", "owner": "direct", "risk": "needs exam-results proof to convert cold traffic"}], "compliance_spine": [{"failure_mode": "unsafeguarded contact with minors", "requirement": "DBS + safeguarding policy for under-18 teaching", "source": "safeguarding law / duty of care"}, {"failure_mode": "fee dispute with parents", "requirement": "Package terms + expiry stated upfront", "source": "consumer law"}], "dark_data": ["trial-to-package conversion rate", "topic-level progress per student (what's actually stuck?)", "lapse predictors (missed weeks before cancel?)"], "dead_data": ["session notes never compiled into reports", "past-paper results never tracked to topics"], "margin_leaks": [{"mechanism": "trial done, package never sold, no follow-up", "name": "trial leakage", "stat_basis": "template-analysis"}, {"mechanism": "lessons drift without expiry enforcement", "name": "package drift", "stat_basis": "template-analysis"}, {"mechanism": "undisclosed marketplace cuts discovered post-payout", "name": "hidden platform tax", "stat": "Tutorful unpublished % + closed to new tutors; MyTutor undisclosed cut (Jul 2026)", "stat_basis": "verified-2026"}], "pain_ranking": [{"fix_id": "FIX-MARKETPLACE-TAX", "pain": "hidden/closed marketplace terms", "rank": 1, "why": "Build on rented ground with unpublished rent — direct-first from day one"}, {"fix_id": "FIX-UNPRICED-EXTRAS", "pain": "trials + reports + catch-ups unbilled", "rank": 2, "why": "Package boundaries decide hourly economics"}, {"fix_id": "FIX-SILENT-CHURN", "pain": "lapsed students never recovered", "rank": 3, "why": "Exam dates are public deadlines — countdown marketing writes itself"}], "scaling_wall": {"bottleneck": "tutor hours: one human teaches one student at a time", "breaks_at": "30+ weekly hours (needs group formats or 2nd tutor)"}, "teardown_id": "td-tutor-gb", "template_id": "tpl-tutor-gb", "vertical": "tutor"}