{"acquisition": [{"channel": "at-need first calls (often out-of-hours)", "owner": "direct", "risk": "the business won or lost in one call — answer always"}, {"channel": "pre-need plans maturing", "owner": "repeat", "risk": "none — pipeline with years of visibility"}, {"channel": "care homes / hospices / coroner referrals", "owner": "referral", "risk": "none — institutional trust, slowest to win, hardest to lose"}], "compliance_spine": [{"failure_mode": "lost custody = liability + reputational death", "requirement": "QR-scanned chain of custody, offline-capable", "source": "duty of care / insurers"}, {"failure_mode": "fee dispute with grieving family (worst possible row)", "requirement": "Disbursements separated at capture, shown from day one", "source": "consumer law + decency"}], "dark_data": ["pre-need conversion lag (years between plan and need)", "disbursement creep per case type", "aftercare → pre-need conversion"], "dead_data": ["old case files never mined for venue/celebrant performance", "memorial anniversary dates never used for aftercare"], "margin_leaks": [{"mechanism": "third-party costs discovered at invoice, disputed by grieving family", "name": "disbursement shock", "stat_basis": "template-analysis"}, {"mechanism": "aftercare never done, pre-need pipeline never fed", "name": "no aftercare motion", "stat_basis": "template-analysis"}, {"mechanism": "whiteboards + memory instead of one record", "name": "coordination chaos", "stat_basis": "template-analysis"}], "pain_ranking": [{"fix_id": "FIX-MISSED-INBOUND", "pain": "first call missed or unstructured", "rank": 1, "why": "One call decides the case; structure decides the margin"}, {"fix_id": "FIX-UNPRICED-EXTRAS", "pain": "disbursement shock at invoice", "rank": 2, "why": "Separate at capture or argue with the bereaved — no third option"}, {"fix_id": "FIX-COMPLIANCE-DRIFT", "pain": "custody gaps + scattered records", "rank": 3, "why": "PlotBox's whole pitch is one record — match it or lose to it"}], "scaling_wall": {"bottleneck": "the director: every arrangement needs their face, every family needs their voice", "breaks_at": "2nd arranger (needs the pack, the record, and the tone rules)"}, "teardown_id": "td-funeral-gb", "template_id": "tpl-funeral-gb", "vertical": "funeral"}