{"acquisition": [{"channel": "NHS App + online triage forms", "owner": "direct", "risk": "digital exclusion — Reception Flow must catch non-digital patients or access fails"}, {"channel": "8am phone queue", "owner": "inbound-queue", "risk": "the rush crushes the desk daily; overflow needs structured capture"}, {"channel": "walk-ins", "owner": "direct", "risk": "none if Reception-Flowed into the same inbox, chaos if shadow-queued"}], "compliance_spine": [{"failure_mode": "clinical harm from machine triage", "requirement": "Agent NEVER triages clinically — admin + navigation only, enforced in policy", "source": "clinical safety / duty of care"}, {"failure_mode": "record fragmented across inbox + EPR", "requirement": "One-click save-to-record (EMIS/SystmOne/Vision)", "source": "record-keeping standards"}], "dark_data": ["demand by request type (what % never needed an appointment?)", "8am rush composition (routine vs urgent mix)", "did-not-attend patterns by clinic"], "dead_data": ["triage outcomes never audited for safety", "SMS replies never mined for demand signals"], "margin_leaks": [{"mechanism": "GP appointments consumed by admin-resolvable requests", "name": "wasted clinical capacity", "stat": "98% of requests marked done in a day under total triage (Accurx); resolution without appointment is the win", "stat_basis": "verified-2026"}, {"mechanism": "staff re-typing across inbox + EPR + phone notes", "name": "system-hopping", "stat_basis": "template-analysis"}, {"mechanism": "recalls unworked while demand queues", "name": "prevention backlog", "stat_basis": "template-analysis"}], "pain_ranking": [{"fix_id": "FIX-MISSED-INBOUND", "pain": "8am rush + multi-channel chaos", "rank": 1, "why": "Total triage funnels everything to one inbox — the model is proven, execution is the gap"}, {"fix_id": "FIX-COMPLIANCE-DRIFT", "pain": "admin/clinical boundary drift", "rank": 2, "why": "The boundary must be policy-enforced, not guideline-hoped"}, {"fix_id": "FIX-SILENT-CHURN", "pain": "recall cohorts unworked (screening/QOF/immunisations)", "rank": 3, "why": "Funded prevention work sitting in lists"}], "scaling_wall": {"bottleneck": "clinician triage time: every request needs qualified eyes", "breaks_at": "list growth without admin-resolution rate rising to match"}, "teardown_id": "td-gp-gb", "template_id": "tpl-gp-gb", "vertical": "gp_surgery"}