{"acquisition": [{"channel": "sourcing runs (charity/car-boot/retail/wholesale)", "owner": "direct", "risk": "none — proprietary deal flow, unreplicable"}, {"channel": "crosslisted demand (buyer finds item anywhere)", "owner": "marketplace", "risk": "fee per platform; double-sell risk without delist discipline"}, {"channel": "repeat buyers / collectors", "owner": "repeat", "risk": "none — best buyers, zero fees off-platform where allowed"}], "compliance_spine": [{"failure_mode": "counterfeit/stolen goods liability", "requirement": "Provenance checks; VERO takedown response", "source": "IP law / platform policy"}, {"failure_mode": "HMRC badges-and-traders CTR threshold breach unnoticed", "requirement": "Trading allowance (£1k) + record-keeping; register when a business", "source": "HMRC"}], "dark_data": ["ROI + days-to-sell per sourcing channel", "fee drag per platform per category", "seasonality per niche"], "dead_data": ["sold comps never reviewed for pricing", "watcher counts never actioned"], "margin_leaks": [{"annual_impact_note": "double-sell = refund + defect + account strike", "mechanism": "sale on one platform, live everywhere else", "name": "failed delists", "stat_basis": "template-analysis"}, {"mechanism": "days-held with no markdown rule; capital + shelf frozen", "name": "dead stock", "stat_basis": "template-analysis"}, {"mechanism": "postage undercharged; packaging unmeasured", "name": "postage bleed", "stat_basis": "template-analysis"}], "pain_ranking": [{"fix_id": "FIX-UNPRICED-EXTRAS", "pain": "double-sells from failed delists", "rank": 1, "why": "Refunds + defects + strikes — account health is the business"}, {"fix_id": "FIX-SILENT-CHURN", "pain": "dead stock with no aging rule", "rank": 2, "why": "Frozen capital; X-days-sell discipline frees it"}, {"fix_id": "FIX-MARKETPLACE-TAX", "pain": "fee-blind listing (wrong platform for the item)", "rank": 3, "why": "Net-first routing beats habit every time"}], "scaling_wall": {"bottleneck": "listing throughput: shoot → measure → grade → list → crosslist per item", "breaks_at": "100+ live listings (needs batch shoot + templates)"}, "teardown_id": "td-reseller-gb", "template_id": "tpl-reseller-gb", "vertical": "reseller"}