{"acquisition": [{"channel": "domestic word of mouth (storm + scare + neighbour-sees-crew)", "owner": "referral", "risk": "seasonal spikes; fear-jobs waste capacity"}, {"channel": "council / commercial contracts", "owner": "repeat", "risk": "none — Contractor Plus portal flow once won"}, {"channel": "insurance / loss-adjuster pipeline", "owner": "referral", "risk": "slowest-paid, highest-ticket — needs parallel tracking"}], "compliance_spine": [{"failure_mode": "injury with lapsed ticket; insurer walks away", "requirement": "NPTC CS-suite + LOLER 6-monthly + IPAF per operative/kit", "source": "NPTC / LOLER / insurers"}, {"failure_mode": "illegal fell; prosecution + reputation death", "requirement": "TPO 6-week council clock honoured (silence = proceed only after window)", "source": "planning law"}, {"failure_mode": "£6m+ claim exposure", "requirement": "£6m+ public liability minimum", "source": "insurers / councils"}], "dark_data": ["quote win rate by ticket band (£800 vs £3k vs 5-fig)", "storm-job profitability (fear-jobs vs proper jobs)", "repeat commercial share"], "dead_data": ["survey photos never reused for quotes", "old TPO outcomes never mined for LPA patterns"], "margin_leaks": [{"mechanism": "cheap fear-jobs crowd out proper tickets; capacity misallocated", "name": "storm indiscipline", "stat_basis": "template-analysis"}, {"mechanism": "insurer pays quarters late, no chase ladder run", "name": "slow insurance cash", "stat_basis": "template-analysis"}, {"mechanism": "crew + chipper + MEWP idle between booked days", "name": "kit idle time", "stat_basis": "template-analysis"}], "pain_ranking": [{"fix_id": "FIX-COMPLIANCE-DRIFT", "pain": "cert/kit/TPO drift across crew and sites", "rank": 1, "why": "Heaviest compliance in the trades — one lapse risks injury + prosecution"}, {"fix_id": "FIX-UNPRICED-EXTRAS", "pain": "storm fear-jobs + insurer extras unpriced", "rank": 2, "why": "Highest tickets in domestic trades need the tightest pricing discipline"}, {"fix_id": "FIX-SILENT-CHURN", "pain": "commercial re-tenders lost for want of evidence", "rank": 3, "why": "Arb Assoc + photo portfolios win councils; scattered files lose them"}], "scaling_wall": {"bottleneck": "climber capacity + kit: you can't clone tickets or chippers", "breaks_at": "2nd crew (crew-leader + kit duplication)"}, "teardown_id": "td-tree-surgeon-gb", "template_id": "tpl-tree-surgeon-gb", "vertical": "tree_surgeon"}