{"acquisition": [{"channel": "Google Shopping + Search (exact/phrase, model numbers)", "owner": "direct", "risk": "CPC inflation on exact-fit terms; feed quality decides everything"}, {"channel": "marketplaces (eBay/Amazon overflow)", "owner": "marketplace", "risk": "fee stack + no customer ownership"}, {"channel": "organic (fitment content, Q&A, compatibility tables)", "owner": "direct", "risk": "none — the ugly moat compounds"}], "compliance_spine": [{"failure_mode": "unsafe/noncompliant product sold (electronics, children's, PPE)", "requirement": "UKCA/CE + category rules per SKU", "source": "UK product safety law"}, {"failure_mode": "wrong-part returns spiral", "requirement": "Verified fitment data per SKU", "source": "consumer law (returns)"}], "dark_data": ["search-term → SKU match rates (what demand has no product?)", "supplier lead-time variance (who slips at peak?)", "return reasons by SKU (fitment vs quality vs damage)"], "dead_data": ["ad click data never joined to margin", "supplier quotes never re-competed"], "margin_leaks": [{"mechanism": "spend continues past proven failure", "name": "unkilled probes", "stat_basis": "template-analysis"}, {"mechanism": "wrong-part orders from weak fitment data", "name": "fitment returns", "stat_basis": "template-analysis"}, {"mechanism": "single supplier = stockout at peak with no fallback", "name": "single-supplier fragility", "stat_basis": "template-analysis"}], "pain_ranking": [{"fix_id": "FIX-UNPRICED-EXTRAS", "pain": "ad spend without kill thresholds", "rank": 1, "why": "Unbounded testing is the fastest way to lose money in ugly commerce"}, {"fix_id": "FIX-SILENT-CHURN", "pain": "one-time buyers never reactivated (filters/parts are repeat!)", "rank": 2, "why": "Consumable ugly products rebuy on schedule — unworked"}, {"fix_id": "FIX-MARKETPLACE-TAX", "pain": "marketplace fees + no customer data", "rank": 3, "why": "Own store keeps margin AND the reactivation list"}], "scaling_wall": {"bottleneck": "supplier ops: stock, lead times, returns, reorders across N suppliers", "breaks_at": "50+ SKUs or 2nd supplier country"}, "teardown_id": "td-dropship-gb", "template_id": "tpl-dropship-gb", "vertical": "dropship"}