{"acquisition": [{"channel": "Fresha/Vagaro marketplace", "owner": "marketplace", "risk": "20% new-client cut (Fresha); add-on creep (Vagaro)"}, {"channel": "Instagram + referrals", "owner": "direct", "risk": "convert to owned booking or pay marketplace rent forever"}, {"channel": "repeat book", "owner": "repeat", "risk": "none — packages lock it in"}], "compliance_spine": [{"failure_mode": "reaction without patch-test record; allergy incident", "requirement": "Patch-test + allergy records per client", "source": "industry duty of care"}, {"failure_mode": "data breach of client photos/preferences", "requirement": "UK GDPR (photos are personal data)", "source": "UK GDPR"}], "dark_data": ["treatment intervals per client (rebook timing)", "retail attach rate per treatment", "package breakage (unredeemed value)"], "dead_data": ["marketing add-ons paid but unrun", "review counts never actioned"], "margin_leaks": [{"mechanism": "empty room + staffed hours, no revenue", "name": "no-shows", "stat": "8% bookings lost sector-wide; deposits -57%", "stat_basis": "verified-2026"}, {"mechanism": "20% Fresha new-client cut; Vagaro add-on stack ($30→$150-200/mo)", "name": "marketplace + SaaS creep", "stat": "Fresha 20% new-client; Vagaro base $30/mo scales with add-ons", "stat_basis": "verified-2026"}, {"mechanism": "calls mid-service go to voicemail on every incumbent (no AI receptionist anywhere in category)", "name": "missed calls", "stat": "Zero of Fresha/Booksy/Vagaro/GlossGenius/Mangomint has voice/SMS/WhatsApp reception", "stat_basis": "verified-2026"}], "pain_ranking": [{"fix_id": "FIX-MISSED-INBOUND", "pain": "calls mid-service go to voicemail — category-wide gap", "rank": 1, "why": "Nobody in the stack answers; the wedge is wide open"}, {"fix_id": "FIX-NOSHOW", "pain": "no-shows on staffed rooms", "rank": 2, "why": "Same proven fix as barber, higher ticket"}, {"fix_id": "FIX-SILENT-CHURN", "pain": "package breakage + lapsed clients unworked", "rank": 3, "why": "Prepaid money leaking both directions"}], "scaling_wall": {"bottleneck": "front desk: phones, reminders, rebooking, retail — one human can't do all four at volume", "breaks_at": "5+ staff or second room"}, "teardown_id": "td-beauty-gb", "template_id": "tpl-beauty-gb", "vertical": "beauty"}