{"acquisition": [{"channel": "tender wins / referrals", "owner": "referral", "risk": "lumpy; pipeline gaps starve the firm quarters later"}, {"channel": "repeat clients / developers", "owner": "repeat", "risk": "none — programme continuity is gold"}, {"channel": "subcontract packages from primes", "owner": "repeat", "risk": "margin squeezed; CIS + retentions bite hardest here"}], "compliance_spine": [{"failure_mode": "site shut down; directors liable", "requirement": "CDM principal-contractor duties, RAMS, toolbox talks", "source": "CDM Regulations"}, {"failure_mode": "CIS penalties + cash shock", "requirement": "CIS verification + correct deductions", "source": "HMRC"}, {"failure_mode": "locked out of tenders", "requirement": "CHAS/SafeContractor/CSCS evidence current", "source": "prequal schemes"}], "dark_data": ["true margin per project after variations + retentions + rework", "snag recurrence by trade (which subbie costs rework?)", "tender win rate + reasons"], "dead_data": ["programme baselines never compared to actuals", "toolbox talk sheets filed never"], "margin_leaks": [{"mechanism": "extras done on instruction, priced never, signed never", "name": "unpriced variations", "stat_basis": "template-analysis"}, {"mechanism": "2.5-5% held 12 months, release never chased", "name": "forgotten retentions", "stat_basis": "template-analysis"}, {"mechanism": "snag drags final payment quarters out", "name": "snag-dragged cash", "stat_basis": "template-analysis"}], "pain_ranking": [{"fix_id": "FIX-UNPRICED-EXTRAS", "pain": "variations worked without price + signature", "rank": 1, "why": "The entire industry's margin lives or dies on this one discipline"}, {"fix_id": "FIX-SILENT-CHURN", "pain": "retentions released late or never chased", "rank": 2, "why": "Interest-free loans to clients that nobody collects"}, {"fix_id": "FIX-COMPLIANCE-DRIFT", "pain": "CIS/RAMS/accreditation drift blocking tenders or sites", "rank": 3, "why": "Locks revenue, not just margin"}], "scaling_wall": {"bottleneck": "the owner-contracts-manager: tendering days, site-walking days, chasing nights", "breaks_at": "£1M+ turnover or 2nd concurrent project"}, "teardown_id": "td-builder-gb", "template_id": "tpl-builder-gb", "vertical": "builder"}